{
  "artifact_type": "MERGE_GATE_RECORD",
  "artifact_role": "DERIVED_GATE_SNAPSHOT_ONLY",
  "status": "MERGE_READY",
  "owner": "WEB_BRAIN",
  "project_id": "JOYFLOW_DEVELOPMENT",
  "task_id": "TASK_PHASE1E_AI_NATIVE_CHANGE_PROJECTION_REPAIR",
  "round_id": 1,
  "repository_id": "example/repo",
  "pr_url": "https://github.com/example/repo/pull/42",
  "reviewed_head_sha": "f8a5f006b48461efacd6573638d0ee74af1bcd53",
  "merge_candidate_freeze_digest": "9534dc884ab768b070b6cf91bec6d4fc39466f89d90207e8d1d08bf34fb2a206",
  "user_acceptance_status": "PASS",
  "user_acceptance_capsule_digest": "adf65d75b3f6fd9dd13fbe918f39c2538b8fb3b58e41f2ab805cce7a0ea0d9a3",
  "user_merge_authorization_digest": null,
  "derivation_basis": "CURRENT_FREEZE_AND_ACCEPTANCE",
  "record_digest": "f6811efa3452cf9fb4aa690161b9e1bdc49f6ad9344eba4cc3d831b5f4af1d0d"
}
