{
  "artifact_type": "MERGE_GATE_RECORD",
  "artifact_role": "DERIVED_GATE_SNAPSHOT_ONLY",
  "status": "MERGE_READY",
  "owner": "WEB_BRAIN",
  "project_id": "JOYFLOW_DEVELOPMENT",
  "task_id": "TASK_PHASE1E_AI_NATIVE_CHANGE_PROJECTION_REPAIR",
  "round_id": 1,
  "repository_id": "example/repo",
  "pr_url": "https://github.com/example/repo/pull/42",
  "reviewed_head_sha": "f8a5f006b48461efacd6573638d0ee74af1bcd53",
  "merge_candidate_freeze_digest": "6c1ca6b831827c19648c891b3341352e29cd91188935ad9d3418d6cb14780070",
  "user_acceptance_status": "PASS",
  "user_acceptance_capsule_digest": "2abeadc0e39ab4db86987f037e0eadc46eb573ae7fadb8a7d0a28348a8560479",
  "user_merge_authorization_digest": null,
  "derivation_basis": "CURRENT_FREEZE_AND_ACCEPTANCE",
  "record_digest": "493071c21d24700b85c9e3d195c16e44739851a95db309f6cbf6440473cb0142"
}
